{
  "$schema": "http://json-schema.org/draft-07/schema#",
  "$id": "https://purposesource.org/schemas/ledger-month/v1.json",
  "title": "v0 committed monthly ledger table (v1)",
  "description": "One month of the append-only ledger: ledger/{YYYY-MM}.json. Implements FS-07 §10 (FS07-100) and VS-36 — at v0 there is no `pg` and no allocator, so the ledger is a committed table maintained by the operator script, carrying the same FS-07 §5.1 row shape and the same FS-07 §5.2 JCS/SHA-256 global hash chain that P-M3 imports unbroken (FS07-101). scripts/ledger-verify.mjs enforces the chain, the append-only law, and month immutability; this schema enforces the shape.",

  "type": "object",
  "additionalProperties": false,
  "required": ["schema", "month", "rows"],
  "properties": {
    "schema": { "const": "ledger-v0/1" },
    "month": {
      "description": "Month key, FS-00 §6.1 grammar. Must equal the filename stem.",
      "type": "string",
      "pattern": "^[0-9]{4}-(0[1-9]|1[0-2])$"
    },
    "note": {
      "description": "Optional human note about the file itself (not a ledger fact). Ledger FACTS that need narrative are `month-note` / `annotation` rows, which are chained; this key is not, so it must never carry anything a reader could mistake for a recorded figure.",
      "type": "string",
      "maxLength": 500
    },
    "rows": {
      "type": "array",
      "items": { "$ref": "#/definitions/row" }
    }
  },

  "definitions": {
    "row": {
      "type": "object",
      "additionalProperties": false,
      "required": [
        "led_id",
        "seq",
        "month",
        "row_type",
        "amount_minor",
        "currency",
        "emitting_job",
        "created_at",
        "prev_hash",
        "row_hash"
      ],
      "properties": {
        "led_id": {
          "description": "Platform-minted ULID, `led_` prefix, lowercase Crockford base32 (FS-00 §6.1).",
          "type": "string",
          "pattern": "^led_[0-9abcdefghjkmnpqrstvwxyz]{26}$"
        },
        "seq": {
          "description": "GLOBAL append order (FS-07 §5.2), contiguous from 1 across every month file. A row's chain predecessor is the row with `seq - 1` REGARDLESS OF MONTH — intake for an open month chains straight onto the current global head, so a later month may legitimately hold a lower seq than an earlier one. `seq` is the chain order; `month` is only a label.",
          "type": "integer",
          "minimum": 1
        },
        "month": {
          "description": "Settlement month this row is assigned to (FS07-041). Must equal the file's `month`.",
          "type": "string",
          "pattern": "^[0-9]{4}-(0[1-9]|1[0-2])$"
        },
        "row_type": {
          "description": "The v0 row-type whitelist. FS07-100 restricts the v0 ledger to intake types — `pool-in`, `refund-out`, `chargeback-out`, `topup-*`, `month-note` — and FS07-041's intake list adds `chargeback-reverse-in`; `annotation` is included because VS-36 requires the annotate-never-restate correction path to be expressible at v0 (FS07-042). NO ALLOCATION ROW TYPE EXISTS BEFORE P-M3: `charged-to-fees`, `reserve-retention` and `hardship-pay` (the two capped lines of ops decision D34, 2026-09-06 — the operations reserve's retention and the steward hardship pay, each its own line even at zero), `commons-alloc`, `directed-alloc`, `directed-to-commons`, `repo-pool`, `category-route`, `category-agg`, `rollforward-*`, `disburse` (one transfer per listed recipient, D33 item 1), `month-lock` and `adjustment` are all absent by design, and ledger-verify.mjs rejects them with a named error rather than a generic enum miss. The four outgoing lines of D34 item 5 arrive with the allocator; until then this table records intake only.",
          "enum": [
            "pool-in",
            "topup-multiplier-in",
            "topup-donation-in",
            "refund-out",
            "chargeback-out",
            "chargeback-reverse-in",
            "month-note",
            "annotation"
          ]
        },
        "amount_minor": {
          "description": "INTEGER minor units (FS-00 §6.1) in `currency`. Negative for the `-out` types; exactly 0 for `month-note` and `annotation`. No floating point ever enters the ledger.",
          "type": "integer"
        },
        "currency": {
          "description": "ISO 4217 code of the reporting currency for this row. The reporting currency is CHF as a working assumption; the ruling is URS OPEN-26.",
          "type": "string",
          "pattern": "^[A-Z]{3}$"
        },
        "src_amount_minor": {
          "description": "Original transaction amount in minor units, where settlement was not in the reporting currency (ENG-037).",
          "type": "integer"
        },
        "src_currency": { "type": "string", "pattern": "^[A-Z]{3}$" },
        "fx_rate": {
          "description": "Rate captured AT THE TRANSACTION (FS07-041), as a decimal STRING — never a JSON number. Money math is integer-only and a float here would be the one place a rounding difference could enter the chain; a string cannot be silently arithmetic'd.",
          "type": "string",
          "pattern": "^[0-9]+\\.[0-9]{1,8}$"
        },
        "fx_source": { "type": "string", "maxLength": 100 },
        "fx_date": { "type": "string", "format": "date" },
        "lane": {
          "description": "Entitlement lane (VS-36). The product catalogue's lanes; only `project` and `donation` are purchasable at v0 (Pass/Portfolio are published schedule, not yet purchasable), but the enum is the full catalogue so a P-M3 import needs no widening.",
          "enum": ["pass", "project", "portfolio", "donation", "waiver"]
        },
        "hold_status": {
          "description": "The allocation state of an intake row (COM-023, ENG-025, as amended by ops decisions D31 and D33): a state of the allocation data, never of money. Since D33 item 4 (2026-09-06) the rule is LOCK BEFORE SWEEP — a month's allocation is computed at the lock, no later than the twentieth day after the month's last rail payout, and each listed recipient's share is transferred directly from the fees account on or before the thirtieth day; there is no intermediary and no earmark instruction. Intake is `open-M+1` (the same token the published ledger contracts `ledger-row.v1` / `ledger-export.v1` use; it keeps its D31 name for contract stability, a published value is never renamed) until its settlement month locks, then `released`. `not-applicable` for zero-amount narrative rows.",
          "enum": ["open-M+1", "released", "not-applicable"]
        },
        "payer_name": {
          "description": "Opted-in payer name, or the literal string `unnamed` (VS-36). Naming is opt-in; the default is `unnamed` and there is no code path that publishes a payer who did not opt in.",
          "type": "string",
          "maxLength": 200
        },
        "ent_id": { "type": "string", "pattern": "^ent_[0-9abcdefghjkmnpqrstvwxyz]{26}$" },
        "co_id": { "type": "string", "pattern": "^co_[0-9abcdefghjkmnpqrstvwxyz]{26}$" },
        "repo_node_id": {
          "description": "Optional repo reference. Registry entries are the display cache; this is the key (FS-00 §6.1).",
          "type": "string",
          "pattern": "^(R_[A-Za-z0-9_-]{6,118}|MDEwOlJlcG9zaXRvcnk[A-Za-z0-9+/=]{1,96})$"
        },
        "category_fund_id": {
          "description": "Donor-designated category for a `topup-donation-in` row (COM-064) — from the curated menu only. Since ops decision D33 item 1 (2026-09-06) a category is the basket of the listed recipients in it, nothing else.",
          "type": "string",
          "pattern": "^cat-[a-z0-9-]{1,40}$"
        },
        "recipient_id": {
          "description": "The listed recipient a `disburse` row transferred to (ops decision D33 item 1; the Recipient List is the published, versioned annex to the statutes). Platform-minted ULID, `rcp_` prefix, lowercase Crockford base32 — the same field `ledger-row.v1` publishes as `recipientId`. Reserved here so the P-M3 import needs no widening; no v0 row carries it, because no `disburse` row exists before the allocator.",
          "type": "string",
          "pattern": "^rcp_[0-9abcdefghjkmnpqrstvwxyz]{26}$"
        },
        "schedule_version": {
          "description": "Schedule version in force for this money-bearing row (ENG-084).",
          "type": "string",
          "maxLength": 40
        },
        "corrects_led_id": {
          "description": "Forward-only correction pointer (FS07-042). Locked rows are immutable forever; a correction is a NEW row pointing back. Nothing in this repo can restate.",
          "type": "string",
          "pattern": "^led_[0-9abcdefghjkmnpqrstvwxyz]{26}$"
        },
        "external_key": {
          "description": "External idempotency key (Paddle transaction/adjustment id, bank statement line id) — unique across the ledger (ENG-065/066). Not personal data.",
          "type": "string",
          "maxLength": 120
        },
        "note": {
          "description": "Required narrative for `month-note` and `annotation` rows. Part of the hashed row, so it is as immutable as an amount.",
          "type": "string",
          "maxLength": 1000
        },
        "emitting_job": {
          "description": "What wrote the row. At v0 this is the operator script (FS-05 §4.2 / VS-27's recording companion), never a job.",
          "type": "string",
          "maxLength": 80
        },
        "created_at": {
          "description": "UTC ISO-8601 instant with a `Z` offset and second precision — a fixed serialisation, because this field is inside the hash.",
          "type": "string",
          "pattern": "^[0-9]{4}-[0-9]{2}-[0-9]{2}T[0-9]{2}:[0-9]{2}:[0-9]{2}Z$"
        },
        "prev_hash": {
          "description": "row_hash of the row at `seq - 1` in global order; 64 zeros at genesis. Excluded from its own row's hash input.",
          "type": "string",
          "pattern": "^[0-9a-f]{64}$"
        },
        "row_hash": {
          "description": "SHA-256( prev_hash_hex_string || JCS(row minus prev_hash and row_hash) ), per FS-07 §5.2 with RFC 8785 canonical JSON. Recomputed by ledger-verify.mjs on every CI run.",
          "type": "string",
          "pattern": "^[0-9a-f]{64}$"
        }
      }
    }
  }
}
